{
  "protocol": "podway.ipc/v1",
  "request_id": "2037d76d-6ea8-42c2-a11f-883248bb8774",
  "client": {
    "name": "podway",
    "version": "1.0.0",
    "pid": 12345
  },
  "operation": "mutate",
  "command": "session.complete",
  "workspace": {
    "root": "/Users/example/src/project-wt",
    "expected_uuid": "83f9fbaa-3df8-4c23-8253-f94098b0af63"
  },
  "idempotency_key": "task-42-complete-verify",
  "preconditions": {
    "session_id": "c1ddd90d-5b6b-40a9-a814-885c6215b916",
    "session_revision": 17,
    "attempt_id": "6f8e7dc4-6502-4857-9d38-1a4afedb50e4"
  },
  "options": {
    "detach": false,
    "wait_timeout_ms": 30000
  },
  "payload": {}
}
